{
  "schemaVersion": "p7m.transport-benchmark/v1",
  "generatedAt": "2026-07-19T02:28:02.763Z",
  "valid": true,
  "methodology": {
    "processIsolation": "fresh real middleware process per fork",
    "engine": "not started; isolates editor transport and canonical middleware path",
    "implementations": {
      "grpc": "frontend/src/main/transport/GrpcTransport.ts",
      "graphql": "frontend/src/main/transport/GraphQlTransport.ts",
      "legacy": "middleware/src/ipc/JsonRpcPeer.ts over the real EditorGateway"
    },
    "percentileMethod": "nearest-rank over successful call latencies from all forks",
    "payloadByteDefinition": "UTF-8 bytes of canonical JSON application payload; excludes protocol framing",
    "graphqlEventPolling": "fixed 10 ms interval",
    "orderPolicy": "payload and transport order rotate deterministically by fork"
  },
  "environment": {
    "node": "v22.23.1",
    "v8": "12.4.254.21-node.56",
    "platform": "linux",
    "osType": "Linux",
    "osRelease": "6.17.0-1020-azure",
    "arch": "x64",
    "cpuModel": "AMD EPYC 7763 64-Core Processor",
    "cpuLogicalCount": 2,
    "totalMemoryBytes": 8323981312,
    "gitCommit": "53200ffd32bc1d76c05320a5f561468cdfec854a",
    "gitDirty": false
  },
  "config": {
    "warmups": 20,
    "samples": 100,
    "forks": 3,
    "concurrency": 1,
    "eventCount": 1000,
    "graphqlPollIntervalMs": 10,
    "requestTimeoutMs": 10000,
    "flowTimeoutMs": 30000
  },
  "payloads": {
    "small": {
      "commandKind": "level/update",
      "canonicalJson": "{\"levelId\":\"transport-benchmark-level\",\"width\":4,\"height\":4,\"tileSize\":16,\"seed\":1729,\"intGrid\":[2,0,0,1,0,0,1,0,0,1,0,2,1,0,0,1],\"rules\":[]}",
      "utf8Bytes": 141,
      "sha256": "4c350ceedf89a89df150a7034f50ac9658603ce4a8831aaee2ad8f5ceaa8322f"
    },
    "medium": {
      "commandKind": "level/update",
      "canonicalJson": "{\"levelId\":\"transport-benchmark-level\",\"width\":32,\"height\":32,\"tileSize\":16,\"seed\":1729,\"intGrid\":[2,0,0,1,0,0,1,0,0,1,0,2,1,0,0,1,0,0,1,0,0,1,2,0,1,0,0,1,0,0,1,0,0,2,0,0,1,0,0,1,0,0,1,0,2,1,0,0,1,0,0,1,0,0,1,2,0,1,0,0,1,0,0,1,0,0,2,0,0,1,0,0,1,0,0,1,0,2,1,0,0,1,0,0,1,0,0,1,2,0,1,0,0,1,0,0,1,0,0,2,0,0,1,0,0,1,0,0,1,0,2,1,0,0,1,0,0,1,0,0,1,2,0,1,0,0,1,0,0,1,0,0,2,0,0,1,0,0,1,0,0,1,0,2,1,0,0,1,0,0,1,0,0,1,2,0,1,0,0,1,0,0,1,0,0,2,0,0,1,0,0,1,0,0,1,0,2,1,0,0,1,0,0,1,0,0,1,2,0,1,0,0,1,0,0,1,0,0,2,0,0,1,0,0,1,0,0,1,0,2,1,0,0,1,0,0,1,0,0,1,2,0,1,0,0,1,0,0,1,0,0,2,0,0,1,0,0,1,0,0,1,0,2,1,0,0,1,0,0,1,0,0,1,2,0,1,0,0,1,0,0,1,0,0,2,0,0,1,0,0,1,0,0,1,0,2,1,0,0,1,0,0,1,0,0,1,2,0,1,0,0,1,0,0,1,0,0,2,0,0,1,0,0,1,0,0,1,0,2,1,0,0,1,0,0,1,0,0,1,2,0,1,0,0,1,0,0,1,0,0,2,0,0,1,0,0,1,0,0,1,0,2,1,0,0,1,0,0,1,0,0,1,2,0,1,0,0,1,0,0,1,0,0,2,0,0,1,0,0,1,0,0,1,0,2,1,0,0,1,0,0,1,0,0,1,2,0,1,0,0,1,0,0,1,0,0,2,0,0,1,0,0,1,0,0,1,0,2,1,0,0,1,0,0,1,0,0,1,2,0,1,0,0,1,0,0,1,0,0,2,0,0,1,0,0,1,0,0,1,0,2,1,0,0,1,0,0,1,0,0,1,2,0,1,0,0,1,0,0,1,0,0,2,0,0,1,0,0,1,0,0,1,0,2,1,0,0,1,0,0,1,0,0,1,2,0,1,0,0,1,0,0,1,0,0,2,0,0,1,0,0,1,0,0,1,0,2,1,0,0,1,0,0,1,0,0,1,2,0,1,0,0,1,0,0,1,0,0,2,0,0,1,0,0,1,0,0,1,0,2,1,0,0,1,0,0,1,0,0,1,2,0,1,0,0,1,0,0,1,0,0,2,0,0,1,0,0,1,0,0,1,0,2,1,0,0,1,0,0,1,0,0,1,2,0,1,0,0,1,0,0,1,0,0,2,0,0,1,0,0,1,0,0,1,0,2,1,0,0,1,0,0,1,0,0,1,2,0,1,0,0,1,0,0,1,0,0,2,0,0,1,0,0,1,0,0,1,0,2,1,0,0,1,0,0,1,0,0,1,2,0,1,0,0,1,0,0,1,0,0,2,0,0,1,0,0,1,0,0,1,0,2,1,0,0,1,0,0,1,0,0,1,2,0,1,0,0,1,0,0,1,0,0,2,0,0,1,0,0,1,0,0,1,0,2,1,0,0,1,0,0,1,0,0,1,2,0,1,0,0,1,0,0,1,0,0,2,0,0,1,0,0,1,0,0,1,0,2,1,0,0,1,0,0,1,0,0,1,2,0,1,0,0,1,0,0,1,0,0,2,0,0,1,0,0,1,0,0,1,0,2,1,0,0,1,0,0,1,0,0,1,2,0,1,0,0,1,0,0,1,0,0,2,0,0,1,0,0,1,0,0,1,0,2,1,0,0,1,0,0,1,0,0,1,2,0,1,0,0,1,0,0,1,0,0,2,0,0,1,0,0,1,0,0,1,0,2,1,0,0,1,0,0,1,0,0,1,2,0,1,0,0,1,0,0,1,0,0,2,0,0,1,0,0,1,0,0,1,0,2,1,0,0,1,0,0,1,0,0,1,2,0,1,0,0,1,0,0,1,0,0,2,0,0,1,0,0,1,0,0,1,0,2,1,0,0,1,0,0,1,0,0,1,2,0,1,0,0,1,0,0,1,0,0,2,0,0,1,0,0,1,0,0,1,0,2,1,0,0,1,0,0,1,0,0,1,2,0,1,0,0,1,0,0,1,0,0,2,0,0,1,0,0,1,0,0,1,0,2,1,0,0,1,0,0,1,0,0,1,2,0,1,0,0,1,0,0,1,0,0,2,0,0,1,0,0,1,0,0,1,0,2,1,0,0,1,0,0,1,0,0,1,2,0,1,0,0,1,0,0,1,0,0,2],\"rules\":[]}",
      "utf8Bytes": 2159,
      "sha256": "e5c6e3647797bc6568c9d993cf17fcd72ecee60ccf97128fa22dbea2f71ce9f1"
    }
  },
  "measurements": [
    {
      "transport": "graphql",
      "payloadClass": "medium",
      "operation": "dispatch",
      "applicationPayloadBytes": 2159,
      "attemptedSamples": 300,
      "successfulSamples": 300,
      "failedSamples": 0,
      "latencyMs": {
        "min": 0.823517,
        "p50": 0.954589,
        "p95": 2.906517,
        "p99": 6.26949,
        "max": 10.330163
      },
      "responseBytes": {
        "min": 2289,
        "p50": 2289,
        "p95": 2289,
        "p99": 2289,
        "max": 2289
      },
      "throughputOpsPerSecond": 749.138,
      "errors": [],
      "resyncs": 0,
      "resyncObservable": false,
      "forks": [
        {
          "fork": 0,
          "attemptedSamples": 100,
          "successfulSamples": 100,
          "failedSamples": 0,
          "wallMs": 106.075553
        },
        {
          "fork": 1,
          "attemptedSamples": 100,
          "successfulSamples": 100,
          "failedSamples": 0,
          "wallMs": 194.35294
        },
        {
          "fork": 2,
          "attemptedSamples": 100,
          "successfulSamples": 100,
          "failedSamples": 0,
          "wallMs": 100.031879
        }
      ]
    },
    {
      "transport": "graphql",
      "payloadClass": "medium",
      "operation": "event-flow",
      "applicationPayloadBytes": 2159,
      "attemptedSamples": 3000,
      "successfulSamples": 3000,
      "failedSamples": 0,
      "latencyMs": {
        "min": 0.801134,
        "p50": 0.940244,
        "p95": 2.471523,
        "p99": 3.976841,
        "max": 12.050815
      },
      "responseBytes": {
        "min": 2289,
        "p50": 2289,
        "p95": 2289,
        "p99": 2289,
        "max": 2289
      },
      "throughputOpsPerSecond": 842.21,
      "errors": [],
      "resyncs": 0,
      "resyncObservable": true,
      "targetEvents": 3000,
      "receivedEvents": 3000,
      "eventCompletionMs": {
        "min": 1078.686055,
        "p50": 1123.634576,
        "p95": 1376.991547,
        "p99": 1376.991547,
        "max": 1376.991547
      },
      "eventCompletionRelativeToLastDispatchMs": {
        "min": 3.133394,
        "p50": 5.409208,
        "p95": 8.699105,
        "p99": 8.699105,
        "max": 8.699105
      },
      "eventThroughputPerSecond": 838.15,
      "forks": [
        {
          "fork": 0,
          "attemptedSamples": 1000,
          "successfulSamples": 1000,
          "failedSamples": 0,
          "wallMs": 1118.220078,
          "targetEvents": 1000,
          "receivedEvents": 1000,
          "completionMs": 1123.634576,
          "completionRelativeToLastDispatchMs": 5.409208
        },
        {
          "fork": 1,
          "attemptedSamples": 1000,
          "successfulSamples": 1000,
          "failedSamples": 0,
          "wallMs": 1368.286381,
          "targetEvents": 1000,
          "receivedEvents": 1000,
          "completionMs": 1376.991547,
          "completionRelativeToLastDispatchMs": 8.699105
        },
        {
          "fork": 2,
          "attemptedSamples": 1000,
          "successfulSamples": 1000,
          "failedSamples": 0,
          "wallMs": 1075.549395,
          "targetEvents": 1000,
          "receivedEvents": 1000,
          "completionMs": 1078.686055,
          "completionRelativeToLastDispatchMs": 3.133394
        }
      ]
    },
    {
      "transport": "graphql",
      "payloadClass": "medium",
      "operation": "query-document",
      "applicationPayloadBytes": 8,
      "attemptedSamples": 300,
      "successfulSamples": 300,
      "failedSamples": 0,
      "latencyMs": {
        "min": 0.523283,
        "p50": 0.618229,
        "p95": 1.131641,
        "p99": 1.862477,
        "max": 2.922227
      },
      "responseBytes": {
        "min": 2300,
        "p50": 2300,
        "p95": 2300,
        "p99": 2300,
        "max": 2300
      },
      "throughputOpsPerSecond": 1401.808,
      "errors": [],
      "resyncs": 0,
      "resyncObservable": false,
      "forks": [
        {
          "fork": 0,
          "attemptedSamples": 100,
          "successfulSamples": 100,
          "failedSamples": 0,
          "wallMs": 66.022715
        },
        {
          "fork": 1,
          "attemptedSamples": 100,
          "successfulSamples": 100,
          "failedSamples": 0,
          "wallMs": 85.934556
        },
        {
          "fork": 2,
          "attemptedSamples": 100,
          "successfulSamples": 100,
          "failedSamples": 0,
          "wallMs": 62.051993
        }
      ]
    },
    {
      "transport": "graphql",
      "payloadClass": "medium",
      "operation": "query-small",
      "applicationPayloadBytes": 6,
      "attemptedSamples": 300,
      "successfulSamples": 300,
      "failedSamples": 0,
      "latencyMs": {
        "min": 0.493056,
        "p50": 0.655902,
        "p95": 0.912931,
        "p99": 2.047123,
        "max": 5.787396
      },
      "responseBytes": {
        "min": 13,
        "p50": 13,
        "p95": 13,
        "p99": 13,
        "max": 13
      },
      "throughputOpsPerSecond": 1394.622,
      "errors": [],
      "resyncs": 0,
      "resyncObservable": false,
      "forks": [
        {
          "fork": 0,
          "attemptedSamples": 100,
          "successfulSamples": 100,
          "failedSamples": 0,
          "wallMs": 80.554657
        },
        {
          "fork": 1,
          "attemptedSamples": 100,
          "successfulSamples": 100,
          "failedSamples": 0,
          "wallMs": 71.745304
        },
        {
          "fork": 2,
          "attemptedSamples": 100,
          "successfulSamples": 100,
          "failedSamples": 0,
          "wallMs": 62.812113
        }
      ]
    },
    {
      "transport": "graphql",
      "payloadClass": "small",